{
  "schema_version": "canopy.gps.collector.v0.2",
  "event_id": "51111111-1111-4111-8111-111111111111",
  "user_id": "52222222-2222-4222-8222-222222222222",
  "device_id": "53333333-3333-4333-8333-333333333333",
  "trip_id": "54444444-4444-4444-8444-444444444444",
  "sequence": 1,
  "event_time": "2026-09-16T02:02:03Z",
  "received_at": "2026-09-16T02:02:04Z",
  "lat": 37.5665,
  "lon": 126.978,
  "accuracy": null,
  "speed": null,
  "altitude_m": null,
  "vertical_accuracy_m": null,
  "course_deg": null,
  "source": "expo-location.background",
  "quality_flags": ["speed_unavailable", "course_unavailable"],
  "raw_location": {"timestamp": 1789524123000, "coords": {}},
  "collection_mode": "user",
  "label": null
}
