{
  "schema_version": "canopy.gps.collector.v0.2",
  "event_id": "61111111-1111-4111-8111-111111111111",
  "user_id": "62222222-2222-4222-8222-222222222222",
  "device_id": "63333333-3333-4333-8333-333333333333",
  "trip_id": "64444444-4444-4444-8444-444444444444",
  "sequence": 2,
  "event_time": "2026-09-16T03:02:03Z",
  "received_at": "2026-09-16T03:02:04Z",
  "lat": 37.57,
  "lon": 126.99,
  "accuracy": 3.0,
  "speed": 4.75,
  "altitude_m": 40.0,
  "vertical_accuracy_m": 1.5,
  "course_deg": 359.5,
  "source": "expo-location.foreground",
  "quality_flags": ["accuracy_above_100m"],
  "raw_location": {"timestamp": 1789527723000, "coords": {"extra": true}},
  "collection_mode": "developer",
  "label": "bike"
}
